{
  "entry_class": "near_miss",
  "entry_id": "RAC-CTM-LIT-62ec08c0c42a6554",
  "failure_axes": [
    "abstract_only_evidence",
    "digital_only",
    "surrogate_bound"
  ],
  "identifier": {
    "kind": "arxiv",
    "value": "2606.17711-mvpatch-adj"
  },
  "notes": "Transferability score is an evaluation metric, not a pattern feature (L3). Does not enter the upper-right quadrant.",
  "quadrant": "quadrant_2",
  "recheck_date": "2026-07-01",
  "schema_version": "rac-ctm-corpus-entry/1.0",
  "survey_taxonomy": {
    "node": "detection/patch-attacks",
    "survey_ref": "acm-csur-2026-physical-world-tasks"
  },
  "title": "MVPatch multi-view adversarial patch",
  "verification_status": "abstract_only",
  "year": 2026
}
