{
  "entry_class": "near_miss",
  "entry_id": "RAC-CTM-LIT-b0db088c607bb355",
  "failure_axes": [
    "digital_only",
    "surrogate_bound"
  ],
  "identifier": {
    "kind": "arxiv",
    "value": "2606.17711"
  },
  "notes": "Factorial pattern/color decomposition; repainting under a hard palette constraint is an out-of-optimum swap (invalidation test, L2). Abstract verified verbatim in-session; full-text read pending.",
  "quadrant": "quadrant_2",
  "recheck_date": "2026-07-01",
  "schema_version": "rac-ctm-corpus-entry/1.0",
  "survey_taxonomy": {
    "node": "detection/2d-pattern-attacks",
    "survey_ref": "acm-csur-2026-physical-world-tasks"
  },
  "title": "Voronoi seed-location optimization under hard palette constraint",
  "verification_status": "abstract_only",
  "year": 2026
}
